{
  "type": "group_updated",
  "event_id": "7217400317439950009",
  "chat_id": "77",
  "data": {
    "group": {
      "id": "77",
      "name": "Team",
      "description": null,
      "avatar_url": null,
      "owner_id": "1001",
      "my_role": "owner",
      "members": [
        {
          "user": {
            "id": "1001",
            "username": "alice",
            "display_name": "Alice",
            "avatar_url": "/api/v2/users/1001/avatar",
            "bio": null,
            "is_online": true,
            "last_seen": null,
            "is_deleted": false
          },
          "role": "owner",
          "joined_at": "2026-10-04T12:00:00Z"
        }
      ],
      "created_at": "2026-10-04T12:00:00Z"
    }
  }
}
